Mate Udovicic/data/anomalije.csv

ID_Uzorka,GPS_LAT,GPS_LONG,Dubina_Busenja_cm,Temp_Tla_C,pH_Vrijednost,H2O_Postotak,Metan_Senzor,Organske_Molekule
197,18.487467,77.385329,10.5,150.0,-2.0,2.28,Pozitivno,Ne
344,18.49621,77.386234,8.5,150.0,-2.0,5.5,Pozitivno,Ne
534,18.465929,77.396655,1.6,150.0,-2.0,2.84,Pozitivno,Ne
594,18.478699,77.400089,10.4,150.0,-2.0,4.85,Pozitivno,Ne
1243,18.473253,77.391354,1.9,150.0,-2.0,4.0,Pozitivno,Ne
1470,18.490267,77.383538,11.9,150.0,-2.0,0.26,Pozitivno,Ne
1670,18.482244,77.375574,0.3,150.0,-2.0,1.15,Pozitivno,Ne
1774,18.47592,77.382056,2.0,150.0,-2.0,1.74,Pozitivno,Ne

Mate Udovicic/README.md

[![Dubina bušenja](assets/graf2_karta_dubine.png)]
Na ovom grafu vidimo odakle su zadovoljavajući uzorci došli.
Najviše ih je došlo sa koordinatama između 18.47 i 18.49 LON te
77.38 i 77.40 LAT i na dubini između 6 i 10 metara

[![Metan](assets/graf3_metan.png)]
Na ovom grafu vidimo prisutnost metana na određenim koordinatama, najveća prisutnost metana
je na koordinatama između 18.47 I 18.49 LON te 77.38 i 77.40 LAT. Koordinate bez prisutnosti
metana su najčešce na koordinatama 18.48 LON,77.39 LAT i 18.48 LON,77.397 LAT.